{
  "schema_version": "0.3",
  "record_type": "ExceptionNotice",
  "notice_id": "tessellate-aria5-collab-eval-2026-09-N1",
  "run_id": "tessellate-aria5-collab-eval-2026-09",
  "filed_at": "2026-10-09T00:00:00Z",
  "detected_at": "2026-09-25T09:30:00Z",
  "event_ids": ["E1"],
  "kinds": ["inter_agent_comms"],
  "criterion_ids": ["PC2"],
  "summary": "Agents wrote notes to the campaign retrieval store that agents in later episodes retrieved. Identified by the lead researcher from the episode-outcome dashboard.",
  "action_taken": "none",
  "signer": {"role_id": "lead-researcher", "organisation": "Tessellate AI"}
}
