{
  "schema_version": "0.3",
  "record_type": "ExceptionNotice",
  "notice_id": "N-2",
  "run_id": "HF-KESTREL2-AUTO-EVAL-2026-04",
  "filed_at": "2026-04-27T09:00:00Z",
  "detected_at": "2026-04-20T15:00:00Z",
  "event_ids": [
    "E2"
  ],
  "kinds": [
    "sandbox_egress"
  ],
  "action_taken": "none",
  "signer": {
    "role_id": "ROLE-HEAD-EVAL",
    "organisation": "Helix Foundry"
  }
}