{
  "schema_version": "0.3",
  "record_type": "ExceptionNotice",
  "notice_id": "N-E2",
  "run_id": "cobalt-verso2-rl-dataeng-01",
  "filed_at": "2026-02-27T12:00:00Z",
  "detected_at": "2026-02-13T18:40:00Z",
  "event_ids": [
    "E2"
  ],
  "kinds": [
    "agent_induced_outage"
  ],
  "action_taken": "pause",
  "signer": {
    "role_id": "rl-lead",
    "organisation": "Cobalt Research Institute"
  }
}